bibo:identifier,dcterms:title,pi:inscription2,pi:inscription1,pi:series,pi:title_eu,pi:we_title,pi:hf_desc,pi:collezione,pi:sign_ecc
06458177-3475-4f4f-ace1-a16d751b42b9,"Pianta di Roma disegnata colla situazione di tutti i Monumenti antichi, de'quali in oggi ancora se ne vedono gli avanzi, ed illustrata colli Frammenti di marmo della Pianta di Roma antica.",,,,,,,,
ca4bd6e3-79ea-4e66-ab67-9f9d0eca1d8d,,"1. Avanzi della Casa di Tito, quali s'internano col primo Piano.<BR>2. Cordonata al Piano superiore.<BR>3. Piazza della Palestra<BR>4. Abbaini, che portano il lume a Bagni, e Corridoj.<BR>5. Cella Soleare con Vestiboli, Atrj, Tablini, Sisto, Cavedj, Esedre per ìFilisofi, e Bagno per gl'Atleti.<BR>6. Bagno degl'Atleti.<BR>7. Portico innanzi al Teatro.<BR>8. Teatro.<BR>9. Emicicli per uso de Filosofi, e della Gioventù, che in essi s'esercitavano, con stanze per riporre le lor vesti, ed i stili necessarj.<BR>10. Tiepidario, detto le Sette Sale.<BR>11. Ponte, per mezzo del quale si passava all'altre Fabriche, come vedremo in appresso.",,,,,,,
8c0acb5e-0967-4564-90af-52fc41a75d28,,,"PIANTA delle Terme di Diocleziano.  Il primo loro piano fu riempiuto di scarichi delle rovine di una parte delle fabbriche del piano superiore, le quali, perchè minacciavano rovina, furon fatte demolire da Sisto V. La tinta più nera indica gli avanzi ch'ﾊesistono, e la più leggiera il supplimento da me fattovi come nelle altre tavole. 1. Argine di Tarquinio al pari di questo piano. 2. Strada selciata che porta ai tre ingressi delle Terme. 3. Vestibolo. 4. Portico, il quale circondava la gran piazza, e conduceva agl'ingressi della Palestra. 5. Vestiboli degli atrj. 6. Tablini. 7. Atrj del Sisto scoperti. 8. Magnifico e vastissimo Sisto, diviso in tre portici, e maggiore di tutti tra le Terme. 9. Luoghi ove si prepparavano gli Atlenti, e gli altri che si esercitavano nel Sisto. 10. Cave di scoperti per dar lume à portici della Palestra. 11. Atrio della Palestra, overo Dieta per uso di chi veniva da questa parte. 12. Stanza degli Atleti con bagno. 13. Alveo, o fossa. 14. Fornelli per riscaldare la stanza predetta. 15. Accademie. 16. Esedre a similitudine di portici per ricovero del Popolo. 17. Area con sedili in prospetto per comodo degli spettatori dè giuochi. 18. Portico che circondava i sedili suddetti fabbricato in maggior elevazione dè medesimi. 19. Biblioteca greca. 20. Biblioteca latina l' una e l' altra fatte quivi trasportare da Diocleziano dal Foro di Traiano. 21. Diversi emicicli, o accademie per uso dè letterati. 22. Luoghi ove s' esercitava la gioventù. 23. Luoghi per riporvi gli strumenti necessari e le vesti degli Atleti e per abitazione degli ufiziali. 24. Abbaini per dar lume al piano inferiore.  25. Tepidario delle Terme. 26. Tempio d' Es' culapio.<BR>27. Tempio della Salute.<BR><BR><BR>",,,,,,
a449fbbb-b265-4c52-a0d3-b394367057c4,,,"Si dimostrano più in grande le Parti principali dell'antecedente Sepolcro d C. Poblicio etc. A Bassamento composto di grossi Travertini, dal tempo, e dagl'incendj corroso, e guasto, sopra cui leggesi l'Iscrizione tale quale si trova al presente, fedelmente copiata la Forma delle Lettere ancora. B Buco, o Finestra fatta ne'tempi posteriori. C Parte angolare, nella quale si fa vedere uno de'Pilastri del Sepolcro. Egli si rende osservabile particolarm.te per essere fusato da poco più sotto la metàsino al Collarino a modo di Colonna. Il diminuire in tal maniera i Pilastri fu comunem.te usato dagli Antichi, et in ispezie, quando dinanzi a quelle porre si doveano delle Colonne, avuta però buona considerazione tanto al sito, quanto alla grandezza dell'Opera. Si veggono tuttavia molti Edifizj antichi, ne'quali ciò non fu praticato, e pertanto il farlo, o non farlo, resta in arbitrio d'ognuno. D La Superficie di questa Parete, trapposta a'Pilastri, (siccome ancora l'altra verso l'altro angolo) da poco più sotto la metàsino all'Architrave tiene la medesima declinazione de'Pilastri a guisa di scarpa: il che meglio apparisce nello Spaccato, E, nel quale si vede la linea superficiale, F, paralella alla linea del Pilastro, G. H Altro Spaccato, il quale dimostra la superficie a linea retta perpendicolare della Parete tra i due Pilastri di mezzo; la quale superficie, quantunque diversa da quella delle Pareti verso gli angoli, pure non ostante tal diversitàsull'Opera resta insensibile, ed anzi grata agli occhi de'riguardanti. Osservasi di più la Base de'Pilastri, formata non secondo le regole di Vitruvio, il quale assegna per altezza alla Base de'Tmpj Toscani la metà del diametro della Colonna: qui ella viene ad essere poco più di un terzo, così,  per mio avviso, determinato dal valente Architetto in questa tale Fabbrica(lo stesso fu fatto nell'altra Fabbrica sepolcrale dirimpetto alla Chiesa di S. Sebastiano fuori della Mura) atteso il Tutto insieme dell'Opera per aggiugnere maggior digntà, e gravitàalla medesima. Perció non sempre si dee stare alle regole di Vitruvio, qual legge inalterabile; Poiché se si faràosservazione sopra i Monumenti antichi, si troveràuna gran varietà di Proporzione, le quali, parlando de'Monumenti più insigni in architettura, si conoscono dirette sempre dalle circostanze del sito, e delle stesse Fabbriche, come spiegherò nell'Opera mia di Archit.ra",,,,,,
953c7170-cc87-4edf-a715-2c66f1e6c9a6,,,"Ornamenti di Stucco, esistenti nella Volta della Stanza Sepolcrale di L. Arrunzio<br><br>Le linee A B C dimostrano una quarta degli Ornamenti della detta Volta, la quale viene scompartita per mezzo di una ben'ordinata Cornice in diverse riquadrature, annesse, e corrispondenti tra loro con maravigliosa simetria, e proporzione. La Cornice di mezzo-rilievo è composta di cinque membretti, cioè di un bastone, due listelli, e due tondini, come distintamente si vede nella Modinatura D; poichè l'altra Modinatura E dinota la Cornice del tondo B, che sta nel mezzo della Volta. Dentro le riquadrature veggonsi in basso rilievo di stucco figure diverse, rabeschi, e grotteschi con tutta l'isquisitezza, ed eccellenza d'arte lavorati, parte de'quali campeggiando in fondo bianco parte in finte pietre di varii colori, come nel Porfido a, nel Giallo antico b, nel Serpentino c; da un tondino parimente dintornate alleggieriscono mirabilmente la Volta, e rendono alla vista un'armonia gratissima. Tal che considerata la Volta tutta in se, e nelle parti, che l'adornano, può meritamente riputarsi per un perfetto modello nel suo genere, e come tale annoverarsi tra gli antichi monumenti più insigni. È notabile la sodezza, con cui è fabbricata, e la incrostatura, di cui è impellicciata; posciachè sepolta da tanti secoli sotto l'umido terreno di una vigna, e con piante di alberi sopra, pur tuttavia si conserva",,,,,,
445ee313-b7de-43bb-923f-74aad781b6a9,,,"CAMERA SEPOLCRALE  pochi passi distante da quella gia descritta della Famiglia di L. Arrunzio nella stessa vigna, scoperta l'anno 1736. Le Pareti contengono una diposizione di Colombaj, sotto ad alcuni de'quali sonovi le Iscrizioni coi nomi de'defonti. Negli altri Colombaj, ove quelle mancano, ne apparè segno alcune d'esservi state; si può credere, che non vi sia stato posto il cenere, come abbiamo osservato parim.te in altre stanze. Questa Camera senza iscrizione alcuna illustre, senza alcun vestigio di nobile ornamento pare, che sia stata fabbricata a comodo, e richiesta comune mediante un patuito prezzo. Il che si può agevolmente supporre anche dalla varietà de'nomi nelle brevi iscrizioni segnati, e dalle Arti ignobili in quelle espresse, tra quali si legge qeulla di un tal L. Aquilio Ciabattino. Vna nicchia sola più grande si osserva in mezzo di una parete, il restante sono tutti Colombaj in buona parte ricoperti dal terreno. Altre Camere a questa contigue, essendo mezzo rovinate, furono demolite del tutto; raccoltane però tra quelle rovine gran quantità di framenti di Casse, Sarcofaghi, Vasi, Vrne e d'altri funebri monumenti. ",,,,,,
7d48321f-accc-448f-8dd2-c73e4ed6ee72,,,"A Framm.to di Stucco, cavato dalla Volta d'un de'Nicchioni interni della Fabbr.ca sepolcrale vicino a Torre de'Schiavi. Egli è diviso da Scompartimenti in basso rilievo formati di un Orlo, ornato di Fusarolli infilati con ordine. Dentro agli Scompartim.ti veggonsi a grottesco varie spezie d'Animali e de'Fogliami. B Profilo della Modinatura degli Scompartim.ti. C Altri Scompartim.ti, i quali vedevansi gli anni passati nella Volta delle quattro Stanze angolari, oggi quasi affatto rovinate. Tale, e tanta è la varietà degli Ornam.ti nelle Fabbr.che posti dagli Antichi con gravità, e magnificenza, che sembra impossibile poter pensare cosa nuova in tal genere, et alle Fabbriche si bene, come essi, adattarla.",,,,,,
6e2e9ea7-3b9c-440e-93d5-a7ccb0038fd1,,"Il Sign.re Abate Venuti in alcuni fogli ultimamente stampati dopo l'edizione de' presenti Volumi, pretende e spiega, che il presente bassorilievo co' susseguenti della Tavola 35. rappresentino la restituzione di Criseide espostaci da Omero nel lib. 1, della Iliade. Riferisce in essi fogli le sottoposte mie relazioni che consistono in quelche comunemente si crede di una cosa tanto difficile da spiegarsi, affine di ricrederne il Pubblico, ma non vi fa veruna obiezione. Prima della produzione di questi stessi Volumi mi fece la finezza di avvertirmi della sua pretensione, ma fu da me riprovata per le troppo sensibili opposizioni che vi ritrovai, e che sono, il prender' egli degli uomini per delle donne: il far comparir Giunone a sedare il tumulto d'Achille, contro l'esposizione d'Omero dopo esserselo proposto per guida della sua spiegazione: il far fare diversi personaggi alle stesse figure esposte dallo Scultore nella presente faccia dell'Urna, e riportate poi ne'fianchi di essa; il prender de' simboli per istrumenti da sacrifizj, gli ornamenti dell'urna per simboli: ed altre molte e molte improprietàe contradizioni che non ho luogo di riferire, ma che ognuno può riconoscere colla visita del marmo e rilevare dalla lettura de' dd fogli. Usciti questi alla luce, ho veduto che il Sig.re Abate non è stato indotto a produrli che dallo spirito di rendersi singolare co'suoi bei trovati contro l'impulso della sua tacita riprovazione di quanto espone; imperocchè avendo percetta l'idea della restituzione di Criseide da un'apparenza di similitudine de'presenti bassirilievi a quei della villa Pinciana che si suppongono rappresentarla, non ne fa la minima menzione per non facilitare al Pubblico colla osservazione della diversità dell'uno e l'altro marmo, l'avvedersi della leggerezza della sua pretensione. Mi stupisco poi che avendo egli avuto tanto talento di produrre una indubitata dichiarazione de' bassirilievi che sono un'accessorio dell'urna, gli sia all'incontro mancato per dire a chi possino riferirsi le figure assise sulla stessa urna, che ne sono l'oggetto principale; e che si sia ristretto a riprovarne, non con altra ragione che del disprezzo, la rappresentazione di Alessandro Severo e Giulia Mammea, sin qui comunemente creduta per tanti motivi, i quali sono, la coincidenza di queste due figure convenientissime a Madre e Figlio, (benche il Sig.re Ab.e per render vecchio il maschio più della femmina, nella copia che n'espone si sia allontanato con una caricatura di barba e di rughe da come ce lo rappresenta il marmo) La precisa similitudine nel marmo non solo della testa del maschio alle medaglie di Alessandro Severo, ma altresì della femmina e sua acconciatura di capo alle medaglie di Mammea: concorrenza la quale esclude l'objezione della rassomiglianza casuale come ben riconobbe l'Eruditissimo Sig.re Abate Barthelemi, Antiquario di S. M. Cristianissima, che fu meco a fare il confronto di più e più di dette medaglie con esso marmo. Il lavoro de' bassirilievi che ci esprime la mediocre abilità de' professori della Scultura àtempi di questo Imperadore; e molti altri riflessi che tralascio nel vedermi obbligato alla brevità. Pretende inoltre il Sign.re Abate in fine de suoi fogli, che i bassirilievi del Vaso da me disegnato nelle seguenti Tavole 34, e 35. rappresentino il giudizio di Paride, ma l'assegnare per Venere un'uomo come ben distinguesi dal senso virile da me fedelmente ritrattato, e il non vedersi il pomo che dovrebbe essere il segno precipuo della pretesa rappresentazione: il prendere per un bastone il panno che tiene il supposto Paride colla sinistra: il dire, che la pretesa Venere lo guardi quando ella guarda all'opposto, e ch'ell'abbia una piccola tazza o conca, quando non v'è: l'aggiungere nel suo disegno le mammelle a questa figura per farla femmina e poi esclamare: chi non diràche qui si rappresenti Venere vincitrice di bellezza le altre Dee.i in somma l'alterare in copia i bassirilievi sono immaginaz.ni* e disaccortezze così sensibili, che non ci fannno vedere uno schiaritore delle Antichità, ma l' Impugnatore delle veritàle più conosciute delle medesime<br>*si veda la Tavola LVII, o sta ultima aggiunta al Tomo IV",,,,,,,
38bec45d-f2b4-424c-9205-02936b0a611e,,,"VEDUTA di un SEPOLCRO antico esistente in una Vigna per la str(a)da di Tivoli circa passi 50 discosto da Ponte Lugano. Questa massiccia machina è costruita di grossi travertini  e sostiene un bellissimo Piedestallo con Bassorilievo di buon maestro mutilato però e guasto dal tempo. Dentro contiene una stanza quadrata co'sua porta, e finestra. Si crede da taluno, che questo siàuno de i quattro gran Pilastri, che ornavano la magnifica entrata della rinomata Villa di Adriano Imperatore. In vero gli anni scorsi ne fù distrutto un'altro a questo vicino e poco disimile, di cui ancora se ne vede giacere l'avanzo de'travertini, che regevano il Bassorilievo, il quale ora si conserva a Villa Albani fuor di Porta Salara. Intanto o sia Pilastro, o sepolcro, com'è voce comune, consideratane l'Architettura Scultura e modinatura delle Cornici sembrami degno d'essere an(n)overato tra i più preziosi antich. mon.ti.",,,,,,
de311dea-87b6-4e01-97e1-688a84bcb370,,,"Iscrizione, e Frammenti delle Camere sepolcrali della Villa de Cinque<br><br>A Aghi di Avorio per le acconciature di capo delle Donne. B Stili di metallo per iscrivere sopra le Tavolette incerate, e per iscancellare occorrendo quello, che scritto vi era. C Spatola od altro consimile stromento, con cui levavansi da Vasi gli unguenti odorosi. D Scure di metallo di quelle forse, che ponevansi nell'insegne consolari. E Vasi cenerarj di terra cotta. F Coperchio de' medesimi. G Vasi di vetro per li Balsami, diformati dal fuoco degl' incendj. H Bottoni di metallo simili all'uso d'oggidì. I Vaso cenerario col suo coperchio, striato, di Alabastro orientale, fiorito, ed agatato di gran preggio, alto palmi due, e mezzo incirca. Ora si conserva presso degl'Illus.mi SS. ri de Cinque possessori della Villa. K Parte di una Volta delle Camere, segnate A. Ella era di forma angolare, distribuita in varj scompartim.ti ornati di pitture, e stucchi. Il centro della Volta era abbellito di una Cornice circolare L, composta, come appare nella Modinatura M. N Tubi, e Tegole di cotto massiccie, quali congiungevansi l'uno all'altro per mezzo dell'incastro. O Bocca, e Coperchio del Pozzo mentovato nella Pianta E della Tavola antecedente.<br>",,,,,,
e2fc439c-ea17-47d6-bb04-b194c8c3c5b3,Iscrizioni del Mausoleo della Famiglia de' Plauzij a Ponte Lugano.,,,,,,,,
c7d72838-5a65-4de0-8688-dc6ae10d068e,"Veduta di un gran masso, avanzo del Sepolcro della Famiglia de' Metelli su la Via Appia a cinque miglia dalla Porta S. Sebastiano, nel Casale di S. Maria Nuova, ecc.",,,,,,,,
4c49f83d-2657-4d15-aa22-6758d8b6e6f2,,,"ALTRO SPACCATO della CAMERA SEPOLCRALE de' LIBERTI e SERVI e c, della Famiglia di AUGSTO. Questa Parete, che forma un fianco della Camera corrispondente in tutto al fianco opposto è divisa in tre Nicchioni di eguale larghezza. Quel di mezzo fatto a semicircolo ha la Volta ornata similm.te di stucco a fog(l)ia di conchiglia. Gli altri due sono quadrati, in un de' quali dal lato sinistro si veggono le due Porte, che davano l'ingresso nella Stanza; l'una al piano; l'altra sopra il Cornicione. In tutti e tre con perfetta simetria sono distribuiti gli ordini de' Colombaj, come nella Parete di faccia gia dimostrata. Entrando per la Porta del piano si vede al primo Pilastro un Cippo funebre di marmo statuario colla sua Iscrizione. Al Nicchione di mezzo un'Avello parimente di marmo scolpito di varie maschere sceniche con molti altri consimili ornamenti. Nell'altro, che segue, fu trovato un Sarcofago di creta cotta. È stato osservato, che dentro lo stesso in un canto eravi un certo rialzo pur di terra cotta pertugiato, alto e largo non più di once sei, il q(u)ale pare, che dovesse servire come di guanciale al defonto",,,,,,
ba9e6cad-e9fe-4509-b0de-6763e9be5a9e,,,"Dopo di aver'esposto nella Tav. passata il Modo, con cui sono state alzate le grandi Pietre nel costruire il Magnifico Sepolcro di Cecilia Metella e c; feci riflessione sopra lo Stromento detto Ulivella, trovato da Brunelesco, et usato oggigiorno, il quale comunem.te credesi, che sia quello, che ci viene accennato da Vitr.o sotto il nome di Forfice, o Tanaglia. Lo Stromento di Brunelesco in vero è molto utile, e comodo; ma quello, che ci viene indicato da Vitr.o, sarà stato certam.te diverso, e forse più facile e porsi in uso. Per tanto appoggiato al Passo di Vitr.o semplicem.te et alle Osservazioni sopra que' Buchi delle Pietre, tante volte mentovati in quest'Opera, ho voluto que'delineare una qualche Idea delle dette Tanaglie di Vitr.o, la quale, se riuscirà di profitto al Publico, godrò di aver ben' impiegate le mie fatiche: altro che nò, apparirà almeno, che io ho avuta l'intenzione di giovare. A Tanaglia di ferro colla sua Pianta B. Ella è composta di due Pezzi; l'uno C D, l'altro E F, congiunti insieme a guisa di Tanaglia, e legati dal Perno G. Sicchè quanto più sono forzati a combaciarsi da un capo, tanto più si aprono dall'altro. Introdotta nel suo buco la Tanaglia nella parte di sotto sino alla linea H, et essendo la Fune, la quale passa per gli Anelli legandoli insieme, tirata all'in sù col mezzo dell'Argano, e della Taglia, stringe forte l'uno con l'altro i medesimi Anelli, e per consegue(n)za allarga la detta parte di sotto, nel buco introdotta, di modo, che medianti i lati di fuori, D, F, dentati, e fatti a coda di rondine, non può uscire dal buco, sinche non è posato il sasso. Per sicurezza maggiore però potrebbesi mandare a forza in H il Cuneo quadrilatero I. Sembrami per tanto, che un tale Ordigno più d'ogni altro si accosti al senso di Vitruvio allorche disse,, ad rechamum autem imum ferrei Forfices, ovvero Forcipes (come alcuni Testi) religantur, quorum dentes in saxa forata acco(m)modantur. K La stessa Tanaglia veduta per fianco e suo Spaccato L, cioè dei due Capi dentati. M Altre due Tanaglie poco differenti dalla stessa. N Cuneo rotondo per allargare le medesime dopo introdotte ne' buchi. O Fune con Uncino, a cui attaccasi la Tanaglia ad Uncino formata. P Vlivella di Brunelesco. Q Spaccato d'uno di que' Sassi grandi con due buchi, i quali si trovano in molti edifizj antichi, per far vedere le due Tanaglie entro a' buchi accomodate. R Spaccati colle loro misure del Buco per gli Uncini descritti nella Tav. antecedente. S Pianta, e Spaccati T, V, colle loro misure del Buco per le Tanaglie. I Buchi delle presenti misure per lo più si trovano ne' Pezzi di Marmo lunghi in circa palmi 8, larghi 4 1/2, grossi 5.",,,,,,
46bf4f0c-6159-4b49-8fce-ce9205ebdcf6,,,,"RACCOLTA DE' TEMPJ ANTICHI. PARTE I. - I TEMPJ DI VESTA MADRE, OSSIA DELLA TERRA E DELLA SIBILLA, AMBEDUE IN TIVOLI, E DELL'ONORE E DELLA VIRTÙ FUORI DI PORTA CAPENA",,,,,
052a04a3-4e7b-470b-befe-681730d8251a,,,,"RACCOLTA DE' TEMPJ ANTICHI. PARTE I. - I TEMPJ DI VESTA MADRE, OSSIA DELLA TERRA E DELLA SIBILLA, AMBEDUE IN TIVOLI, E DELL'ONORE E DELLA  VIRTÙ FUORI DI PORTA CAPENA",,,,,
427f7c8f-e211-4ee4-968a-03ecfd5c81ac,,,,"RACCOLTA DE' TEMPJ ANTICHI. PARTE I. - I TEMPJ DI VESTA MADRE, OSSIA DELLA TERRA E DELLA SIBILLA, AMBEDUE IN TIVOLI, E DELL'ONORE E DELLA  VIRTÙ FUORI DI PORTA CAPENA",,,,,
3925c18d-4d91-4b37-864d-0dcd93dad8ca,,,,"RACCOLTA DE' TEMPJ ANTICHI. PARTE I. - I TEMPJ DI VESTA MADRE, OSSIA DELLA TERRA E DELLA SIBILLA, AMBEDUE IN TIVOLI, E DELL'ONORE E DELLA VIRTÙ FUORI DI PORTA CAPENA",,,,,
3fded41d-fdac-46b6-a600-8b5764d920c0,,,,"RACCOLTA DE' TEMPJ ANTICHI. PARTE I. - I TEMPJ DI VESTA MADRE, OSSIA DELLA TERRA E DELLA SIBILLA, AMBEDUE IN TIVOLI, E DELL'ONORE E DELLA VIRTÙ FUORI DI PORTA CAPENA",,,,,
63877b18-9230-4981-9f8d-0e5cc91db094,,,,"RACCOLTA DE' TEMPJ ANTICHI. PARTE I. - I TEMPJ DI VESTA MADRE, OSSIA DELLA TERRA E DELLA SIBILLA, AMBEDUE IN TIVOLI, E DELL'ONORE E DELLA  VIRTÙ FUORI DI PORTA CAPENA",,,,,
83bb9713-87ca-4483-98dc-5504c3ed7a2b,,,,"RACCOLTA DE' TEMPJ ANTICHI. PARTE I. - I TEMPJ DI VESTA MADRE, OSSIA DELLA TERRA E DELLA SIBILLA, AMBEDUE IN TIVOLI, E DELL'ONORE E DELLA VIRTÙ FUORI DI PORTA CAPENA",,,,,
993bdfc9-45a0-4bcb-ad0d-ba7b71866b19,,,,"RACCOLTA DE' TEMPJ ANTICHI. PARTE I. - I TEMPJ DI VESTA MADRE, OSSIA DELLA TERRA E DELLA SIBILLA, AMBEDUE IN TIVOLI, E DELL'ONORE E DELLA  VIRTÙ FUORI DI PORTA CAPENA",,,,,
cdfb421d-f151-4c0d-a8f3-b6ede6f5de31,,,,"RACCOLTA DE' TEMPJ ANTICHI. PARTE I. - I TEMPJ DI VESTA MADRE, OSSIA DELLA TERRA E DELLA SIBILLA, AMBEDUE IN TIVOLI, E DELL'ONORE E DELLA VIRTÙ FUORI DI PORTA CAPENA",,,,,
29710e52-2d6d-4cf4-9db2-496cc95d498a,,,,"RACCOLTA DE' TEMPJ ANTICHI. PARTE I. - I TEMPJ DI VESTA MADRE, OSSIA DELLA TERRA E DELLA SIBILLA, AMBEDUE IN TIVOLI, E DELL'ONORE E DELLA  VIRTÙ FUORI DI PORTA CAPENA",,,,,
15c6a428-a21f-41e9-b2a5-b077884d7922,,,,"RACCOLTA DE' TEMPJ ANTICHI. PARTE I. - I TEMPJ DI VESTA MADRE, OSSIA DELLA TERRA E DELLA SIBILLA, AMBEDUE IN TIVOLI, E DELL'ONORE E DELLA  VIRTÙ FUORI DI PORTA CAPENA",,,,,
d1950f00-7adc-4605-b0f6-6a358de5f2ed,,,,"RACCOLTA DE' TEMPJ ANTICHI. PARTE I. - I TEMPJ DI VESTA MADRE, OSSIA DELLA TERRA E DELLA SIBILLA, AMBEDUE IN TIVOLI, E DELL'ONORE E DELLA  VIRTÙ FUORI DI PORTA CAPENA",,,,,
783ba731-830f-4736-8ae4-d9f746761906,,,,"RACCOLTA DE' TEMPJ ANTICHI. PARTE I. - I TEMPJ DI VESTA MADRE, OSSIA DELLA TERRA E DELLA SIBILLA, AMBEDUE IN TIVOLI, E DELL'ONORE E DELLA VIRTÙ FUORI DI PORTA CAPENA",,,,,
04293e06-6203-410e-9bc0-0f798a20e4b1,,,,"RACCOLTA DE' TEMPJ ANTICHI. PARTE I. - I TEMPJ DI VESTA MADRE, OSSIA DELLA TERRA E DELLA SIBILLA, AMBEDUE IN TIVOLI, E DELL'ONORE E DELLA  VIRTÙ FUORI DI PORTA CAPENA",,,,,
9850eec3-079c-48f7-8002-26e4de14fefc,,,,"RACCOLTA DE' TEMPJ ANTICHI. PARTE I. - I TEMPJ DI VESTA MADRE, OSSIA DELLA TERRA E DELLA SIBILLA, AMBEDUE IN TIVOLI, E DELL'ONORE E DELLA  VIRTÙ FUORI DI PORTA CAPENA",,,,,
cdfb065a-bf05-42c4-8fdd-60d7bd74d502,,,,"RACCOLTA DE' TEMPJ ANTICHI. PARTE I. - I TEMPJ DI VESTA MADRE, OSSIA DELLA TERRA E DELLA SIBILLA, AMBEDUE IN TIVOLI, E DELL'ONORE E DELLA VIRTÙ FUORI DI PORTA CAPENA",,,,,
847d2bad-aef5-42c5-8682-8b264f44cf9d,Fianco del Tempio dell'Onore e della Virtù.,,,"RACCOLTA DE' TEMPJ ANTICHI. PARTE I. - I TEMPJ DI VESTA MADRE, OSSIA DELLA TERRA E DELLA SIBILLA, AMBEDUE IN TIVOLI, E DELL'ONORE E DELLA  VIRTÙ FUORI DI PORTA CAPENA",Fianco del Tempio dell'Onore e della Virtù.,,,,
cfd6c671-5f72-4019-9d2c-2d88a6d3c9f7,"Spaccato del Pronao, o Portico del Tempio dell'Onore e della Virtù.",,,"RACCOLTA DE' TEMPJ ANTICHI. PARTE I. - I TEMPJ DI VESTA MADRE, OSSIA DELLA TERRA E DELLA SIBILLA, AMBEDUE IN TIVOLI, E DELL'ONORE E DELLA VIRTÙ FUORI DI PORTA CAPENA","Spaccato del Pronao, o Portico del Tempio dell'Onore e della  Virtù.",,,,
d2e36998-803f-4ef1-83ef-b62051282398,,,,"RACCOLTA DE' TEMPJ ANTICHI. PARTE I. - I TEMPJ DI VESTA MADRE, OSSIA DELLA TERRA E DELLA SIBILLA, AMBEDUE IN TIVOLI, E DELL'ONORE E DELLA VIRTÙ FUORI DI PORTA CAPENA",,,,,
16c4865f-4bf1-4305-b303-5962532b004f,Spaccato per traverso del Tempio dell'Onore e della Virtù.,,,"RACCOLTA DE' TEMPJ ANTICHI. PARTE I. - I TEMPJ DI VESTA MADRE, OSSIA DELLA TERRA E DELLA SIBILLA, AMBEDUE IN TIVOLI, E DELL'ONORE E DELLA VIRTÙ FUORI DI PORTA CAPENA",Spaccato per traverso del Tempio dell'Onore e della Virtù.,,,,
1905f5c7-ad6b-4c45-8550-480537a14058,Modinature in grande delle parti del Tempio dell'Onore e della Virtù.,,,"RACCOLTA DE' TEMPJ ANTICHI. PARTE I. - I TEMPJ DI VESTA MADRE, OSSIA DELLA TERRA E DELLA SIBILLA, AMBEDUE IN TIVOLI, E DELL'ONORE E DELLA VIRTÙ FUORI DI PORTA CAPENA",Modinature in grande delle parti del Tempio dell'Onore e della  Virtù.,,,,
022df497-b768-4f2d-a8be-4690ddaba020,,,,"RACCOLTA DE' TEMPJ ANTICHI. PARTE I. - I TEMPJ DI VESTA MADRE, OSSIA DELLA TERRA E DELLA SIBILLA, AMBEDUE IN TIVOLI, E DELL'ONORE E DELLA VIRTÙ FUORI DI PORTA CAPENA",,,,,
3c449449-834d-4605-89b1-fa93835ff3bb,,,,"RACCOLTA DE' TEMPJ ANTICHI. PARTE I. - I TEMPJ DI VESTA MADRE, OSSIA DELLA TERRA E DELLA SIBILLA, AMBEDUE IN TIVOLI, E DELL'ONORE E DELLA  VIRTÙ FUORI DI PORTA CAPENA",,,,,
be92f2a2-7133-448f-885f-8711601dea09,,,,"RACCOLTA DE' TEMPJ ANTICHI. PARTE I. - I TEMPJ DI VESTA MADRE, OSSIA DELLA TERRA E DELLA SIBILLA, AMBEDUE IN TIVOLI, E DELL'ONORE E DELLA VIRTÙ FUORI DI PORTA CAPENA",,,,,
600d397e-6a1d-4ff9-8ead-200b3b90e3a6,,,,,,"View of one of the ancient circuses surrounded by other mouments.
(Reduced version of original frontispiece to Volume III of Antichità Romane.)",,,
c6cc0628-77c0-4966-be61-da69383ed5fb,,,,,,"Portion of a hanging city, approachable by sea from below.
(Reduced version of original frontispiece to Volume IV of Antichità Romane.)",,,
cc25a1e8-1bc5-4666-a1a9-54f68337eb48,,,,,,,"21. 25. Des ruines, une statue de faune, un tronçon de colonne dirigé vers la droite. A gauche, un lion (?) de pierre et, contre le socle, des médaillons. Au dernier plan, un arc de triomphe à peine mordu. - Sig. en bas à gauche, dans la gr. - H. 0.395. L. 0.55.",,
