bibo:identifier,dcterms:title,pi:inscription2,pi:inscription1,pi:series,pi:title_eu,pi:we_title,pi:hf_desc,pi:collezione,pi:sign_ecc
2347c98b-de65-42c0-8228-47b1710812f6,,"Indice delle Fabbriche Ippodromo, ovvero luogo, di addestrar Cavalli, posto nella parte più depressa delle Fabbriche esistenti; che appartiene al Conte Centini erede del Conte Fede.<br>1. Ingressi nel medesimo.<br>2. Stalle rovinate, che servivano di sostruzione al Poggio superiore, al paro del quale era un'altro ordine di Fabbrica per uso, e commodo de Cavallarizzi, Garzoni, ed altrezzi di Scuderia.<br>3. Poggio superiore all'Ippodromo.<br>4. Sostruzione del medesimo sulla Strada antica.<br>5. Magazzeni per Orzo, Fieno, e Paglia,<br>6. Edifizio rotondo con quattro ingressi, investito da Nicchioni.<br>7. Muro di sostruzione al Poggio più alto Lettera A.<br>Bisogna avvertire, che l'Incisione più forte in tutta la Piantaindica i Muri esistenti, e quei scoperti nei diversi scavi: e la leggiera ciò che si è raccolto da frammenti de' Muri, in corrispondenza del totale degli Edifici. L'Incisione pontinata indica i Corridori sotterranei che passano sotto le Fabbriche.<br><br>Naumachia, o Stagno per esercitarvi sulle Navi di Mare; e per esibire i Mostri, e Pesci Marini.<br>8. Portico di fronte all'Ippodromo, che da l'ingresso alla Naumachia.<br>9. Adito ad una delle Scale B<br>10. Scale, che assendevano alla Loggia coperta dé Spettatori C.<br>11. Loggia coperta.<br>12. Gradi per i Sedili allo scoperto dé Spettatori, modernamente rinnovati in altra forma.<br>13. Vomitori, o Scalette né gradi sudetti.<br>14. Cordonate, che dal piano superiore scendevano nella Loggia coperta, e nel primo sedite dé Spettatori.<br>15. Luogo circondato dà Muri con Nicchie per ornamento della sostruzione.<br>16. Tempio di Nettuno soprastante alla Naumachia con due fronti.<br>17. Gradi del Tribunale del Tempio. Nel Sito di queste rovine sono sparvi framenti di Colonne, Architravi, e Fregj di Marmo scolpiti, con corse di Animali, e Mostri Marini guidati dà Genj. Qui presso esistevano i Capitelli con Delfini per Volute, che ora s'ammirano nel Museo Pontifio del Vaticano, e due dei Pilastri conserviamo nella nostra Galleria, quali ornamenti decoravano la Naumachia, ed il Temipio suddetto.<br><br>Teatro. Egli é in oggi diruto, già disegnato dal Ligorio, e dal Contini. Alcuni Muri di esso si scoprirono nell'Anno 1775 nella Vigna pertinente al Seminario Vescovile di Tivoli; ed altri esistono nel Fossicello segnato D.<br>1. Fronte della Scena.<br>2. Portici ai Lati del Proscenio.<br>3. Pulpito.<br>4. Orchestra.<br>5. Portici esteriori ai gradi.<br>6. Scalette, che conducono à Sedili de' Spettatori.<br>7. Vestiarj, e Spogliatori degli Attori.<br>8. Luoghi per le Macchine della Scena.<br>9. Scale, che salgono à detti Edifizi.<br>10. Sentiero moderno, che passa il Fosso. <br>Questo Teatro é all'uso Romano, imperocche é formato secondo i precetti di Vitruvio, con Pulpito basso, e amplo, a distinzione dell'altro, che viene in appresso, à il Timelio, o Pulpito alto, e stretto. Questo era tutto fabbricato sopra terra, sostenuto dalli Portici circolari descritti. L'altro parte era inazucito, nel Monte, restando la sua Orchestra nel piano più depresso del terreno, che lo circonda. I Gradi poi che erano sopraterra venivano sostenuti da contraforti, e quelli incavati nel Monte aveano un Corridore sotterraneo.<br><br>Palestra. Luogo dove si facevano esercizj per render robusto il Corpo, come la Lotta, il Salto, i giuochi del Disco, e de Cesti, ed altri. Sito che appartiene al Conte Centini.<br>1. Peristilio per lottare a scoperto con tre Portici semplici per commodo de' Spettatori, ed uno doppio per lottare a coperto.<br>2. Stanze per nudarsi, ungersi, e cretarsi i Lottatori, Saltatori, ed altri, che si esercitavano nel Ginnasio.<br>3. Scale, che ascendevano a piani superiori<br>4. Sisto di due piani, il superiore con portici doppi in oggi diruti.<br>5. Portici, che circondano per due lati il primo piano del Sisto, e sostenevano le passeggiate scoperte.<br>6. Corridori sotterranei, che servivano di sostruzione al sopraposto portico del Sisto. In uno di essi segnato E scorre l'Acqua, la quale fa mostra alla Fontana nel sito F. detta ora di Palazzo.<br>7. Corpo di Fabbriche per diversi usi degli Atleti, con Portici interni doppi, e Portico esterno, che sostenevano l'Area di un Peristilio superiore.<br>8. Forma dell'Acqua, che si ripartiva ne Lavatori, o Bagni di quei che si esercitavano nella Palestra.<br>9. Essedre quadrale, o Sale nobili, che erano ornate di Marmi, e Stucchi.<br>10. Stanze contigue a dette Sale, con Volte già ornate di Stucchi, e Pitture, come si osservano ne' luoghi G. e H.<br>11. Adito di communicazione alle Sale suddette, con Volta a finissimi Stucchi, come si vede ne' frammenti II.<br>12. Galleria, o Tablino ornato già di Statue, come da Nicchie esistenti. Nella Tribuna di mezzo quadro eravi collocata una Statua sedente, congetturandosi dal Piedestallo di Marmo greco, che ivi si osserva.<br>Conviene qui notare, che le Fabbriche di uso commune, come sono le indicate dell'Ippodromo, Naumachia, Teatro, Palestra, e Castro sono nella parte più bassa; all'incontro le seguenti del Ninfeo, Pisianatteo, Stadio, Vestibulo, Terme, e Canopo sono in piano medio. Per regolamento de piani, o Aree delle medesime, parte sono introdotte nel cavo del Monte, come lo Stadio, le Terme, ed il Canopo, e parte con carichi di Terra, come il piano del Pisianatteo, verso la Valle, e i Giardini; Questi cavi hanno somministrato la materia per le Fabbriche composte per la maggior parte di Tufi di colore leonato, uniti alli corsi de' Mattoni fraposti nella formazione delle Pareti.<br><br>Ninfeo, ovvero luogo delizioso di Fontane, ora si possiede dal Conte sudetto.<br>1. Sostruzione del Poggio superiore ornata di Nicchie quadrate, ed intonacate di pomici, e tartari dipinti.<br>2. Continuazione della medesima con Nicchie semicircolare.<br>3. Cavea con fondo semicircolare, e Nicchie per Fontane ornate di pomici, e tartari dipinti d'azzuro, e verde; la quale serviva di prospetto ad un Viale.<br>4. Opposta sostruzione del Poggio, con Nicchie semicircolare per Fontane surrilmente ornate <br>5. Sostruzioni irregolari, che reggono un angolo del Poggio.<br>6. Tempio rotondo d'ordine Dorico, come da frammenti sparvi nel Poggio si riconosce: occupa il mezzo per far mostra ai varj aspetti del Ninfeo, e dedicato era alle Ninfe presidenti delle Acque.<br>7. Scala del Tribunale del Tempio.<br>8. Recinto semicircolare del Tempio, con varie aperture.<br>9. Podj al piano del Poggio per riguardare le sottoposte Fontane del Ninfeo.<br>10. Corpo di Edifizio nobile a diversi piani per trattenersi presso il Ninfeo.<br>11. Stanza con volta ornata di finissimi stucchi, e grotteschi con fondo dipinto.<br>12. Scala che ascendeva ai diversi piani di detto Edifizio.<br>13. Portico che l'adornava.<br>14. Albergo con Portico per uso dé Castellarj, o Fontanieri del Ninfeo.<br>15. Adito di communicazione a diverse parti delle Fabbriche.<br>16. Conicoli per uso del Ninfeo. <br>Nel sito indicato nella Pianta con nome di Pantanello, presso l'Ippodromo, era luogo ove scolavano vicine sorgenti, e le Acque piovane. Quivi Mon. Hamilton Pittore Inglese tentò una cava, col dar esito alle Acque per mezzo di una Forma, e vi rinvenne nel fondo di esso un prodigioso numero di frammenti di Statue, frà Teste, Mani, Redi, Vasi, Conclelabri, Animali, Bassirilievi di ottima Sculttura, Colonne di Giallo antico, e di Alabastro, ed altri Marimi mischi, ne' tenendo conto dé Capitelli, Basi, Cornici, e Fregj intagliati, e rocchi di Colonne di Marmo ordnario, che rilassò nello stesso fondo. Questo ammasso di frammenti si pretende adunato per dispreggio di Religione, e per barbarie d'ignoranza, che pose in rovina la moltiplice quantità degli adornamenti, che avevano le Fabbriche della Villa, credendo in tal modo restassero distrutte, ed annullate per sempre.",ALLA MAESTÀ DI STANISLAO AVGVSTO<br>RE DI POLONIA<br>PROMOTORE LIBERALISSIMO DELLE BELLE ARTI<br>FRANCESCO PIRANESI ARCHITETTO ROMANO<br>VMILI E CONSAGRA,,,,,,
35d69603-e608-4059-9d42-b44e9bfea2d7,,,"Castro, o luogo per gli alloggiamenti dé Pretoriani, o guardie del Corpo. Sito in parte del Canonico Maderni, e della Camera Apostolica.<br>1. Corpo di guardia del Castro a diversi piani, il primo piano corrisponde a quello dell'Ippodromo descritto.<br>2. Scale, che ascendono ai piani superiori per communicazione a seguenti alloggiamenti.<br>3. Alloggiamenti degli Vfficiali delle guardie in Poggio, più alto.<br>4. Sito, ove furono ritrovate dal Michilli le Statue dell'Arpocrate, della Flora, ed altre, che sono nel Museo del Campidoglio.<br>5. Sostruzione del Poggio superiore K.<br>6. Clivo congiunto alla Strada indicata incavato nel colle per ascendere all'adito delle Vie sotterranee L, le quali passavano nelle diverse parti della Villa. La sostruzione M. del Poggio del Pecile é formata a diversi piani, a seconda del divo nel pianterreno dé quali si ripartivano i Cavalli, e le Guardie nelle Celle di sopra.<br>7. Sterqiuilinio, e Latrina per comodo delle Guardie <br>8. Muro di sostruzione al Colle tagliato.<br>9. Contraforti nell'angolo del medesimo.<br>10. Tempio di Marte, come da Muri e, Frammenti scoperti nel lavorar la Vigna si é riconosciuto.<br><br>Pisianatteo, o Portico doppio, e vario per ornamento di Pitture, è però chiamato Pecile; ivi i seguaci della Filosofia stoica si esercitavano nelle dispute. Sito, che in oggi possiede il Conte Centini<br>1. Portico doppio a Pilastri diviso da Muro, riguardando un lato del grande Peristilio, e l'altro dell'Area opposta.<br>2. Teste del medesimo di forma quasi circolare che communicavano all'uno, e l'altro Portico.<br>3. Communicazione nel mezzo del Muro corrispondente alla Strada.<br>4. Portico semplice, che circonda tre lati dell'Arca del grande Peristilio.<br>5. Essedra nel mezzo della testa a Levante.<br>6. Stagno, o Piscina nel mezzo del Peristilio.<br>7. Portico, che dal Peristilio communicava alle Fabbriche contigue.<br>8. Sisto, o Passaggio scoperto, con Podio sull'alloggiamento delle Guardie, che riguarda la Valle, esso communicava ai Portici del Peristilio, e all'altro Portico che proseguiva.<br>9. Dieta con Essedra ornata di Nicchie, quadrate, con Passaggi in una testa del Portico doppio, e nell'Edificio circolare.<br>10. Edificio circolare con Portico ornato di Fontane per delizia; ha nel mezzo dell'Arca una Fabbrica esternamente circolare, con quattro piccoli Ponti, che passavano sopra l'Euripo, o Canale di Acqua, che scorreva tra il Portico, e la Fabbrica di mezzo.<br>11. Area quadrata, che ha in mezzo dé lati quattro Aditi, ornati innanzi di Colonne disposte in porzione di cerchio, i quali communicavano sopra i Ponticelli descritti. I Fregj di questa Fabbrica erano ornati con Bassirilievi, rappresentanti corse sopra le Acque di Mostri Marini, Genj, Vcelli,  e di altri Animali.<br>12. Cellule di trattenimento di vaga forma.<br>13. Passaggio in un Giardinetto, che ha di fronte una prospettiva ornata di Nicchie<br>14. Nicchione di contro il passaggio suddetto.<br>15. Scale che dal Giardino salivano al Poggio ed al piano di sopra del Portico rotondo.<br>16. Sostruzione del Poggio del Giardinetto.<br>17. Essedra con Nicchia, ove dal Conte Fede fù rinvenuto il Fauno di Marmo rosso, ora nel Museo Vaticano, come anche Frammenti diversi di Statue, e Marmi mischi in ogni parte di questo Edifizio. Ella é rivolta di fronte alla longa Area K. che é di fianco al Pisianatteo, che servir dovea di delizioso Giardino.<br><br>Biblioteca Greca, e Latina, sito del Conte Centini.<br>1. Biblioteca Greca a due piani, le Pareti inferiori erano dipinte a Grotteschi.<br>2. Essedra, o Sala innanzi di essa, per commodo dé Studenti. La Volta era coperta di Mosaico turchino.<br>3. Gabbinetti; in uno di essi restano nella Volta frammenti di Grotteschi.<br>4. Gradini, che dalla sottoposta Area della Biblioteca ascendevano all'Essedra indicata.<br>5. Scala, che scendeva al Giardinetto già desscritto N.<br>6. Stanze per uso, e commodo della Biblioteca.<br>7. Galleria a due piani, ha nelle teste due Tribune con Volte dipinte a Grotteschi.<br>8. Scala, che ascendeva al secondo piano.<br>9. Biblioteca Latina con Tribuna.<br>10. Sala innanzi di essa.<br>11. Scala, che dall'Area innanzi la Biblioteca, vi si saliva.<br>12. Stanze di varia figura per uso, e commodo della Biblioteca.<br>13. Scale per salire al piano superiore.<br>14. Cavedio con Peristilio di Colonne per trattenimento, e passeggio dé Studenti.<br>15. Fontana sotto un lato del Peristilio.<br>16. Passaggi di communicazione coll'Edificio circolare descritto, e nel Giardino N.<br>17. Altri passaggi a diversi luoghi.<br>18. Sostruzione, che pone in piano l'Area delle Biblioteche, ornata di portico con Nicchie.<br>19. Poggio inferiore, che conteneva un Giardino di delizia per li Studenti.<br>20. Scala, che dal Poggio inferiore saliva al Giardino.<br>21. Nicchie sotto la Scala per le Fontane.<br>22. Sostruzione intorno al Giardino.<br>23. Conserva d'Acqua con Nicchie esterne per Fontane<br>24. Altra Conserva; Ambedue soministravano Acqua al Ninfeo, ed altrove.<br>25. Corridore sotterraneo di communicazione con quelli del Ninfeo. <br> Questi Edifici delle Biblioteche sono rivolti all'aspetto del Cielo, secondo che Vetruvio nel trattato dell'Architettura distintamente descrive; dà che si conosce quando fosse degli antichi Architettori la diligenza in conservare i precetti dell'Arte, affinche, corrispondessero all'uso, e commodo già da Vecchi esperimentato in vantaggio della conservazione dé Volumi, e del lume necessario, e continuato per gli Studenti, che giornalmente leggono.<br><br>Stadio, o luogo atto per la Lotta, ed altri Esercizj per render robusto il Corpo. Sito del Conte Centini.<br>1. Parte semicircolare con Sedili per li Spettatori<br>2. Luogo per i Giudici, ed Arbitri della Corsa, e Lotta.<br>3. Portici per Lottare à coperto.<br>4. Corridore sotterraneo per passaggio alle contigue Fabbriche.<br>5. Cavedio con tre Essedre, o Emicili con Portici intorno per commodo, e trattenimento per i Studenti della Setta Stoica.<br>6. Tempio del Nume, che questi adoravano.<br>7. Porta di Communicazione al Portico del gran Peristilio.<br>8. Ingressi con Gradini nel mezzo dell'Essedre, che dall'Areà O. vi si ascendeva.<br>9. Celle negli Angoli.<br>10. Galleria, ch'era ornata di Marmi, e Bassirilievi.<br>11. Stanze nobili di trattenimento.<br>12. Sala con Colonne, e Porta, che entra nello Stadio.<br>13. Portici laterali all'Edificio.<br>14. Arca quadrata con Nicchie quadre, e curve in un lato di essa, che formavano Edicole con Colonne, e adornavano l'esterna parte dé seguenti Bagni.<br>15. Passaggio a detti Bagni dal Peristilio.<br>16. Aspetto dé medesimi.<br>17. Gradini, che dall'Area O. ascendevano all'ingressi.<br>18. Stanze di Bagni, di varia, e vaga figura, erano nobilmente ornate di Marmi coloriti, e mischi.<br>19. Stanzini per laconici apoditeri parimenti di diversa figura<br>20. Picciola Stanza semicircolare con Volta dipinta a grotteschi.<br>21. Sala principale di communicazione con in Bagni, e corrisponde al mezzo del seguente Peristilio.<br>22. Peristilio con Colonne da tre lati.<br>23. Cortili scoperti.<br>24. sostruzione al Poggio superiore P.<br>25. Muro, che racchiude i descritti Bagni<br>26. Corridore sotterraneo di communicazione alle parti della Villa. sono degne di osservazone le parti di questi Edifici per la loro bizzarra figura, e sembra che qui più d'ogn'altro siano in forma di quelli, che si vedevano in Greca, poiche i Romani altro Stadio non ebbero, che quello di Domiziano, e quello che unirono per gli Essercizj della Ginnastica nelle Terme.",,,,,,
ef131727-51f1-414e-b76a-5c57d3c1083e,,,"13. Orchestra con Pavimento a quadrati di Marmo.<br>14. Spazio innanzi al Pulpito di piano superiore all'Orchestra.<br>15. Porte sotto il Pulpito con Gradini, che siendevano nel detto spazio.<br>16. Gradini, che calavano nell'Orchestra.<br>17. Logion, o Pulpito per gli Attori.<br>18. Scena con le tre Porte ornate di quattro Colonne a due ordini, il primo di Granito ed il secondo di giallo antico.<br>19. Proscenj.<br>20. Spazio tra i Proscenj, e i gradi per i personaggj distinti, come più dapresso agli Attori.<br>21. Porte con Gradini per salirvi.<br>22. Portico dietro la Scena al piano del Pulpito, serviva per il vestiario, e trattenimento degli Attori, e superiormente per le Macchine, che aggivano nel Teatro.<br>23. Porte con Gradini a detto Portico.<br>24. Corridore sotterraneo, che dall'Orchestra del Teatro si calava nel Crittoportico in tempo di Pioggia.<br>25. Contraforti della Cavea del Teatro intorno al muro esteriore, che circonda i Gradi per sostenere la spinta di essi nel sopraterra.<br><br>Ergastulo, e Crittoportico. Era l'Ergastulo un ristretto per contenere i Schiavi destinati alle opere rustiche della Villa. Il Crittoportico era un passaggio coperto per ogni Staggione. Ambedue sono incavati nel Monte. L'Incisione di essi é distinta chiara per esser Fabbrica sotterra.<br>1. Corsia, che divide le picciole Celle, illuminata dà feritore nella Volta.<br>2. Celle, che non ricorrono di fronte l'una all'altra. Il tutto ricoperto di Stucco.<br>3. Corridore, che passa al Crittoportico.<br>4. Crittoportico illuminato nella Volta da feritore rotonde. Egli é investito di opera laterizia per difenderlo dall'umido, ed intonacato di Stucco.<br>5. Corridore sotteraneo, che communicava all'Accademia, e al Giardino Imperiale.<br>6. Altro allo Stadio, acciocché gli Spettatori si ricoverassero nel Crittoportico in tempo di Pioggia.<br>7. Stadio rustico incavato nel vivo del Monte.<br>8. Fontana con Portico in porzione di cerchio.<br>9. Conserve di Acqua per detta nel piano superiore<br>10. Tempio di Serapide con portico intorno, ed Atrio con Ale laterali.<br>11. Portico innanzi dell'Atrio.<br>12. Alberghi per coloro, che andavano agl'Oracoli<br>13. Acquedotto, che traversa la Valle.<br>14. Sostruzione al Poggio, e muri rovinati.<br><br>Liceo, Il Liceo era uno dé Ginnansj presso la Città d'Atene, ornato di Portici spaziosi in mezzo di piantaggioni di Platoni, e di Giardini, ove Aristotile soleva passeggiando insegnare la sua Filosofia, per la qual cosa vennero i suoi seguaci, denominati Filosofi Peripatetici.<br>1. Gran Portico doppio diviso da lungo Muro con teste formate di due essedre per commodo di sedersi, e riposarsi, e medesime davano il passaggio da un portico, all'altro.<br>2. Avanzi delle Abitazioni del Liceo, che due secoli, e mezzo fà il Ligorio osservò esistenti i Fornelli, e l'Ipocausti per Bagni.<br>3. Sorgente del rivo chiamato Acqua Ferrata.<br>4. Rovine di Portici sotterranei, ora pieni di Acqua.<br>5. Spazio dei grandi Giardini.<br>6. Muri rovinati.<br>7. Edificio quadrato, con fornice rovinato.<br>8. Prospettiva di Fontane, ornate di Pomici, e Tartari, sopra cui passava un'Acquedotto.<br>9. Acquedotto sopra Archi, e Muri, che sostenavano il Poggio B.B. de' Giardini.<br>10. Muri, sopra dé quali passava la diramazione del detto Acquedotto.<br>11. Rovine dé Muri.<br>12. Altre di un Edificio, che non sene scorge l'uso.<br>13. Rovine di un'altro Acquedotto.<br>14. Muri rovinati nel Poggio più basso.<br><br>Pritaneo, ovvero luogo della Villa Imperiale cosi detto a similitudine di quello di Atene, ove si radunavano i Senatori, e si facevano i Conviti publici in allegrezza dé grandi avvenimenti. Questa parte della Villa é la più alta di tutto il Colle, ed e' ora denominata li Colli di Santo Stefano.<br>1. Peristilio ornato di Colonne scoperte nell'ultima Cava fatta dal De Angelis.<br>2. Fontana di bizzarra, é vaga forma nel mezzo di un lato del Peristilio, con cascata di Acqua intonacata di Marmi scoperti nella cava suddetta.<br>3. Stanze laterali alla medesima.<br>4. Corridore con Volta sostenuta da Piloni.<br>5. Essedra quadrata nel fondo del detto, con quattro Nicchioni per sedili.<br>6. Conclavi in un lato del Peristilio.<br>7. Portico triplice nel piano inferiore del Peristilio: Formava la sostruzione del medesimo, ed avea sopra un sisto a passeggio scoperto, che pareggiava al piano del Peristilio.<br>8. Fondo di un lato del triplice Portico chiuso, ed illuminato da Fenestre, in esso ancora restano Pitture a Grotteschi, che formano diversi riquadri, ne quali sono figurati alcuni Poeti Greci sedenti, con proprj nomi scritti di sopra.<br>9. Luoghi ove esistono i riquadri dé grotteschi, e l'incassi dé Bassirilievi frapostivi, che hanno in testa i cartelli, ne quali erano scritti i nomi delli Scultori, o la rappresentazione, dé soggetti scolpiti.<br>10. Corridore con contraforti di sostruzione, per communicazione al seguente Anfiteatro.<br>11. Anfiteatro diruto, del quale non esiste, che porzione dé Muri, che reggevano le Volte dei Gradi; ed interamente resta quello, che cingeva l'Area, la forma di esso non é ovale, come gli altri Anfiteatri antichi.<br>12. Triclinio magnifico, o Salone da mangiare ornato di Colonne.<br>13. Rovine di Edificio contiguo al detto.<br>14. Abitazioni del Pritaneo.<br>15. Peristilio con Portico innanzi.<br>16. Oecj, o Sale ornate di Colonne.<br>17. Sostruzione al Poggio del triplice Portico del Pritaneo.<br>18. Avanzi di un Portico doppio a Pilastri molto rovinato.<br>19. Piscina incavata nel Colle con Scale per scendervi; i suoi Muri sono intonacati di opera signina, cioé di coccio pisto per reggere l'Acqua, la quale vi ha lassato un grosso Tartaro.<br>20. Corpo di Fabbrica nobile affatto rovinato, questo terreno essendo ridotto a Campo, sovente l'Aratro scopre i suoi Pavimenti fatti a Mosaico. <br><br>Avvertimento al Lettore<br>Esibisce questa Pianta l'aggregato delle Fabbriche esistenti sopra un Colle disteso, e vario di Poggj della magnifica gran Villa edificata dall'Imperadore P. Elio Adriano, la quale dal suo nome fù chiamata Elia, e dal territorio di Tivoli Tiburtina. Le Fabbriche sono ritratte dal piano di ogni Poggio sopra quali s'inalzano. Elleno furono intitolate con nomi celebri dé luoghi maravigliosi delle provincie dell'Impero Romano, Come attesta Sparziano nella Vita di questo Imperadore: ""Tiburtinam Villam miré exaedificavit ita ut in ea, et provinciarum, et locorum celeberrima nomina inscriberet: velut Lijceum, Academia, Prijtaneum, Canopum, Poecilem Tempe vocaret"" Ed ogni qualvolta era sfacendato vi andava a Villeggiare, e secondo il costume dei Ricchi felici, vi Fabbricava Palazzi prendeva cura dé posti delle Statue, e delle Pitture. Ecco le proprie parole di Aurelio Vittore: ""Deinde, uti solet tranquillis rebus remissior; Rus proprium Tibur secessi, ipse uti beatis locupletibus mos, Palatia extraere, curare Epulas, Signa, Tabulas pictas: postremo omnia satis anxie prospicere, quae luxus lasciviaeque essent"" Soggiunge l'addotto Sparziano: ""et ut nihil praetermitter etiam Inferes finxit."" Occupa questa Pianta diverse Fabbriche esistenti un Colle disteso da Tramontana a Mezzo giorno, che ha di lungehzza circa tre mila passi, di larghezza un settimo nella più distesa, parte: l'uno de lati della sua lunghezza é rivolto a Levante, e l'altro a Ponente verso la Campagna di Roma. Il sito denominato Tempe, e gli Inferi, come anche quello per le Selve, e Parchi degli Animali, dovea esser molto maggiore di quello immaginato intorno alle ritratte Fabbriche. In una Pianta generale, a parte si daranno gli Edifizj, che s'incontrano in questa parte dell'Agro Tiburtino. E per piena intelligenza di questa superbissima Villa, si incideranno le parte in grande di alcuni Edifizj, come altresi un'altra Pianta delle Fabbriche, che investono il Monte, unitamente ai suoi sotterranei, i quali soltanto qui sono accennati con punti per non confonderli colle Fabbriche, che gli sono sopraposte. Conviene per fine persuadersi, che gli Edifizj di questa Villa superavano ogn'altro tanto per la magnificenza, che per l'ornamento, e per la loro vaga, e bizzarra figura: Dalle quali cose molto possono profittare, i Professori di Architettura.<br>Nel basso della Pianta sono incise le iscrizioni dé bolli dé Mattoni, che sono contrasegnate con asterisco.＊",,,,,,
2b955894-4b43-490c-908a-62aa2c621aac,,,Cérès ou l'Eté: sa tête est couronnée d'épis: elle tient une corne d'abondance..........<BR>Tirés de la Galerie d'Altoviti.,,,,,,
3a21b0dc-bc95-4169-a4dd-ecfe592b7519,,,,,"Vue de toutes les Boutiques de droite et de gouche de la rue, prise vis-à-vis la Porte de la Ville de Pompeia. On découvre en premier la Maison du Chirurgien.",,,,
44921e87-b0f0-461e-b52f-ed1a9567e552,,,,,Plan de deux Atrium toscans et Pluviatum de Vitruve adaptés à diverses Cours des maisons vis-à-vis celle du Chirurgien é Pompeïa.,,,,
